{
  "id": "urn:ngsi-ld:gbfs:id:UKBQ:60920452",
  "type": "gbfs",
  "last_updated": 1450156395,
  "ttl": 566,
  "version": "2.1",
  "data": {
    "feeds": [
      {
        "name": "station_information",
        "url": "urn:ngsi-ld:gbfs:url:EPHA:59077032"
      },
      {
        "name": "system_hours",
        "url": "urn:ngsi-ld:gbfs:url:GDPS:83970346"
      }
    ]
  }
}